created_at;id_str;full_text;quote_count;reply_count;retweet_count;favorite_count;lang;user_id_str;conversation_id_str;username;tweet_url
Tue Oct 17 16:04:13 +0000 2023;1,71431E+18;@FirmanNew8 @jansen_jsp @officialMKRI Kalau partai parlemen gak usulkan/dukung capres di thn 2024, akan kena sanksi di pemilu 2029. Itu yg berat, brother.;0;0;0;0;in;2908614643;1,71425E+18;muad_marzuki;https://twitter.com/muad_marzuki/status/1714311360761450811
Tue Oct 17 15:42:41 +0000 2023;1,71431E+18;Relawan Pro Jokowi (Projo) resmi mendeklarasikan dukungannya untuk Bakal Calon Presiden (Bacapres) Prabowo Subianto di kontestasi Pemilu 2024. dekade08;0;0;0;0;in;1,51123E+18;1,71431E+18;HanyRetina;https://twitter.com/HanyRetina/status/1714305940294639747
Tue Oct 17 15:27:46 +0000 2023;1,7143E+18;Polda Jabar Gelar Operasi Mantap Brata, Kapolda Optimistis Tahapan Pemilu 2024 Bakal Kondusif https://t.co/umD1ILQyYZ https://t.co/0VnivuTncU;0;0;0;0;in;8,73213E+17;1,7143E+18;maunglucu;https://twitter.com/maunglucu/status/1714302186774233350
Tue Oct 17 14:11:31 +0000 2023;1,71428E+18;*Polda Jabar Gelar Pasukan Menghadapi Operasi Mantap Brata Mengamankan Pemilu Damai 2024*  Dalam menghadapi tingkat keamanan dalam merayakan kontestasi pesta demokrasi dalam pemilu tahun 2024, https://t.co/7PAa2Hbg6g;0;0;0;0;in;1,59535E+18;1,71428E+18;polsek_skjd;https://twitter.com/polsek_skjd/status/1714283000387776556
Tue Oct 17 14:00:34 +0000 2023;1,71428E+18;Edukasi politik..  . #sby #susilobambangyudoyono #presidensby #guritacikeas #putusanmk #mahkamahkonstitusi #partaidemokrat #partaipolitik #pemilu2024 #pemiluserentak2024 #pemiludamai https://t.co/BjjXZlDwxs;0;0;0;0;eu;4776469164;1,71428E+18;ArrisKurniawan;https://twitter.com/ArrisKurniawan/status/1714280241756250618
Tue Oct 17 13:59:47 +0000 2023;1,71428E+18;Pak Bambang juga menegaskan, jika ada ASN yang melanggar akan dikenakan sanksi sesuai ketentuan yang berlaku.   Sementara itu, Pak Bambang berharap di Kota Bandung menjelang Pemilu 2024 berjalan kondusif.  @RESTABES_BDG  @kodim0618ktbdg  @DPRDKotaBandung  @KejariBdg https://t.co/jriOfQfs5W;0;0;0;0;in;1933882213;1,71428E+18;halo_bandung;https://twitter.com/halo_bandung/status/1714280045630644343
Tue Oct 17 13:19:12 +0000 2023;1,71427E+18;Polda Jabar Gelar Pasukan Menghadapi Operasi Mantap Brata Mengamankan Pemilu Damai 2024*  Dalam menghadapi tingkat keamanan dalam merayakan kontestasi pesta demokrasi dalam pemilu tahun 2024, Polda Jabar melaksanakan gelar pasukan yang merupakan bentuk pengecekan akhir kesiapan https://t.co/fjrT3yokaR;0;0;0;1;in;1,18436E+18;1,71427E+18;PolsekNagreg;https://twitter.com/PolsekNagreg/status/1714269831678374173
Tue Oct 17 12:54:35 +0000 2023;1,71426E+18;Kapolda Jabar bersama dengan Pangdam III/Siliwangi dan Pj. Gubernur Jabar laksanakan kegiatan Apel Gelar Pasukan Operasi Mantap Brata Lodaya 2023-2024, dalam Rangka Pengamanan Pemilu 2024. https://t.co/nFG4QxRadx;0;0;0;1;in;9,15793E+17;1,71426E+18;PolsekBanjaran;https://twitter.com/PolsekBanjaran/status/1714263636456415592
Tue Oct 17 12:40:49 +0000 2023;1,71426E+18;*Polda Jabar Gelar Pasukan Menghadapi Operasi Mantap Brata Mengamankan Pemilu Damai 2024*  Dalam menghadapi tingkat keamanan dalam merayakan kontestasi pesta demokrasi dalam pemilu tahun 2024, Polda Jabar melaksanakan gelar pasukan https://t.co/oItBpLIWt8;0;0;0;0;in;1,23181E+18;1,71426E+18;SekDayeuhkolot1;https://twitter.com/SekDayeuhkolot1/status/1714260171793576436
Tue Oct 17 11:12:43 +0000 2023;1,71424E+18;Kapolri Teken Deklarasi Pemilu Damai 2024  Kapolri Jenderal Polisi Drs. Listyo Sigit Prabowo, https://t.co/Q9QWRD6IpJ., telah menandatangani deklarasi Pemilu damai di Lapangan Silang Monas, Jakarta Pusat (17/10).  #DamaiPemiluIndonesia Bahagia Berpesta Demokrasi https://t.co/c51YigEbK4;0;0;0;0;in;1,59535E+18;1,71424E+18;polsek_skjd;https://twitter.com/polsek_skjd/status/1714238002506129481
Tue Oct 17 10:22:49 +0000 2023;1,71423E+18;"Mari kenali 5 Kertas Surat Suara untuk Pemilu 2024    Sarifah Ainun Jariyah, S IP ""  #SeputarCaleg  #PDIPerjuangan #SAJ #SantunAmanahJujur  #SarifahAinunJariyah  #ganjarpresiden2024 https://t.co/53Ep3ymP7f""";0;0;0;1;in;1,35995E+18;1,71423E+18;seputarcaleg;https://twitter.com/seputarcaleg/status/1714225445456195894
Tue Oct 17 09:55:16 +0000 2023;1,71422E+18;Kapolri Teken Deklarasi Pemilu Damai 2024  Kapolri Jenderal Polisi Drs. Listyo Sigit Prabowo, https://t.co/TwPK7Lrekz., telah menandatangani deklarasi Pemilu damai di Lapangan Silang Monas, Jakarta Pusat (17/10). https://t.co/7wCIvXETiq;0;0;0;1;in;1,23181E+18;1,71422E+18;SekDayeuhkolot1;https://twitter.com/SekDayeuhkolot1/status/1714218512447902037
Tue Oct 17 09:52:43 +0000 2023;1,71422E+18;Kapolri menyatakan bahwa jajaran Kepolisian bersama TNI dan instansi terkait siap mengawal dan mengamankan Pemilu 2024 agar berjalan aman dan damai. Hal tersebut diungkapkan Kapolri dalam Apel Gelar Pasukan Operasi Mantap Brata 2023-2024 yang digelar di Lapangan Silang Monas, https://t.co/QLPbxP3xrr;0;0;0;1;in;1,23181E+18;1,71422E+18;SekDayeuhkolot1;https://twitter.com/SekDayeuhkolot1/status/1714217868555157703
Tue Oct 17 09:44:43 +0000 2023;1,71422E+18;Plt. Camat Mandalajati mengikuti Istighosah dan Do'a Bersama dalam rangka Persiapan Pengamanan PEMILU tahun 2024 sehingga terciptanya KAMTIBMAS Kota Bandung yang aman dan kondusif di @polrestabandung   Selasa, 17 Oktober 2023  @pembdg  @DiskominfoBdg  @humasbandung_ @halo_bandung https://t.co/LQPkZRg8Co;0;0;0;0;in;1910318696;1,71422E+18;kec_mandalajati;https://twitter.com/kec_mandalajati/status/1714215856228704320
Tue Oct 17 09:39:57 +0000 2023;1,71421E+18;Sinergi Wujudkan Pemilu 2024 #DamaiPemiluIndonesia  Potret saat Kapolri Jenderal Polisi Drs. Listyo Sigit Prabowo, https://t.co/TwPK7Lrekz., menyematkan tanda Operasi Mantap Brata 2023-2024 kepada personel Polri dan personel dari instansi terkait di Lapangan Silang Monas, https://t.co/q5iPtMcDTb;0;0;0;1;in;1,23181E+18;1,71421E+18;SekDayeuhkolot1;https://twitter.com/SekDayeuhkolot1/status/1714214656116711894
Tue Oct 17 09:18:12 +0000 2023;1,71421E+18;Kapolri Teken Deklarasi Pemilu Damai 2024  Kapolri Jenderal Polisi Drs. Listyo Sigit Prabowo, https://t.co/OHKOGI5dTk. telah menandatangani deklarasi Pemilu damai di Lapangan Silang Monas, Jakarta (17/10). Deklarasi damai diikuti oleh TNI, KPU, DKPP, Bawaslu #DamaiPemiluIndonesia https://t.co/tIeGx7YU8j;5;10;9;11;in;1,18436E+18;1,71421E+18;PolsekNagreg;https://twitter.com/PolsekNagreg/status/1714209183414063370
Tue Oct 17 09:17:18 +0000 2023;1,71421E+18;Kapolri Jenderal Polisi Drs. Listyo Sigit Prabowo, https://t.co/KT2RCy3wjQ., telah menandatangani deklarasi Pemilu damai di Lapangan Silang Monas, Jakarta Pusat (17/10). Deklarasi damai diikuti oleh TNI, KPU, DKPP, Bawaslu, bersama partai politik peserta Pemilu 2024. https://t.co/yB7xATeOrb;0;0;0;0;in;2939226972;1,71421E+18;f5a1c284d13340e;https://twitter.com/f5a1c284d13340e/status/1714208956569296992
Tue Oct 17 09:16:36 +0000 2023;1,71421E+18;Kapolri Teken Deklarasi Pemilu Damai 2024  Kapolri Jenderal Polisi Drs. Listyo Sigit Prabowo, https://t.co/fr5YlRl6aq., telah menandatangani deklarasi Pemilu damai di Lapangan Silang Monas, Jakarta Pusat (17/10). https://t.co/JN6eECje3F;0;0;0;0;in;9,15793E+17;1,71421E+18;PolsekBanjaran;https://twitter.com/PolsekBanjaran/status/1714208781637472297
Tue Oct 17 09:16:22 +0000 2023;1,71421E+18;Kapolri menyatakan bahwa jajaran Kepolisian bersama TNI dan instansi terkait siap mengawal dan mengamankan Pemilu 2024 agar berjalan aman dan damai. Hal tersebut diungkapkan Kapolri dalam Apel Gelar Pasukan Operasi Mantap Brata 2023-2024 digelar di Lapangan Silang Monas,17/10 https://t.co/vw1iOOYB9r;0;0;0;0;in;2939226972;1,71421E+18;f5a1c284d13340e;https://twitter.com/f5a1c284d13340e/status/1714208723198202276
Tue Oct 17 09:16:16 +0000 2023;1,71421E+18;Kapolri menyatakan bahwa jajaran Kepolisian bersama TNI dan instansi terkait siap mengawal dan mengamankan Pemilu 2024 agar berjalan aman dan damai. Hal tersebut diungkapkan Kapolri dalam Apel Gelar Pasukan Operasi Mantap Brata 2023-2024    #DamaiPemiluIndonesia https://t.co/n0i5JuOdWT;5;10;9;11;in;1,18436E+18;1,71421E+18;PolsekNagreg;https://twitter.com/PolsekNagreg/status/1714208697642332279
Tue Oct 17 09:15:07 +0000 2023;1,71421E+18;Respons Putusan MK, Guntur Romli: Adakah Wasit yang adil untuk Pemilu 2024? https://t.co/Vn0gpxFEKU;0;0;0;0;in;9,06176E+17;1,71421E+18;Jayaneg14;https://twitter.com/Jayaneg14/status/1714208409120358682
Tue Oct 17 09:12:31 +0000 2023;1,71421E+18;Sinergi Wujudkan Pemilu 2024 #DamaiPemiluIndonesia  Potret saat Kapolri Jenderal Polisi Drs. Listyo Sigit Prabowo, https://t.co/OHKOGI5dTk., menyematkan tanda Operasi Mantap Brata 2023-2024 kepada personel Polri dan personel dari instansi terkait di Lapangan Silang Monas, https://t.co/KN63N1OHUA;5;10;9;11;in;1,18436E+18;1,71421E+18;PolsekNagreg;https://twitter.com/PolsekNagreg/status/1714207754293006504
Tue Oct 17 09:11:43 +0000 2023;1,71421E+18;Sinergi Wujudkan Pemilu 2024 #DamaiPemiluIndonesia  Potret saat Kapolri Jenderal Polisi Drs. Listyo Sigit Prabowo, https://t.co/fr5YlRl6aq., menyematkan tanda Operasi Mantap Brata 2023-2024 kepada personel Polri dan personel dari instansi terkait di Lapangan Silang Monas, https://t.co/aSl5pBoGEC;0;0;0;0;in;9,15793E+17;1,71421E+18;PolsekBanjaran;https://twitter.com/PolsekBanjaran/status/1714207554014970360
Tue Oct 17 08:57:13 +0000 2023;1,7142E+18;Kirab Pemilu 2024 akan yang diawali dari 7 wilayah perbatasan Indonesia. Ketujuh perbatasan tersebut yaitu Aceh, Kepulauan Riau, Kalimantan Utara, Kalimantan Barat, Maluku Utara, Nusa Tenggara Barat dan Papua yang puncaknya pada 26 Desember 2023 akan digelar di Jakarta. https://t.co/hRtgxx7DBv;0;1;0;0;in;1933882213;1,7142E+18;halo_bandung;https://twitter.com/halo_bandung/status/1714203902655304141
Tue Oct 17 08:57:10 +0000 2023;1,7142E+18;Kota Bandung akan menjadi salah satu titik Kirab Pemilu 2024 yang digelar Komisi Pemilihan Umum pada 26 Oktober 2023 mendatang👏 https://t.co/F0qMlIN8Ta;0;1;0;0;in;1933882213;1,7142E+18;halo_bandung;https://twitter.com/halo_bandung/status/1714203890667950188
Tue Oct 17 08:00:02 +0000 2023;1,71419E+18;Pemilu 2024, Bey: ASN Jaga Netralitas  #Jabar #JawaBarat #AdpimJabar  https://t.co/KahHbS1rJO;0;0;0;0;in;1,41268E+18;1,71419E+18;westjavagov_;https://twitter.com/westjavagov_/status/1714189510333124965
Tue Oct 17 07:00:00 +0000 2023;1,71417E+18;Bey Machmudin Optimistis Pemilu 2024 di Jabar Kondusif  #Jabar #JawaBarat #AdpimJabar  https://t.co/2vu3snk8B9;0;0;0;0;in;1,41268E+18;1,71417E+18;westjavagov_;https://twitter.com/westjavagov_/status/1714174403359932431
Tue Oct 17 05:54:06 +0000 2023;1,71416E+18;@mapplecrush @prabowo Relawan Joko Widodo alias Projo secara resmi memberikan dukungan kepada Prabowo Subianto di Pemilu 2024. dekade08;0;0;0;0;in;1,65795E+18;1,71414E+18;valenlaurenciaa;https://twitter.com/valenlaurenciaa/status/1714157820055376013
Tue Oct 17 05:48:53 +0000 2023;1,71416E+18;Pemilu 2024, Bey: ASN Jaga Netralitas  Selengkapnya di https://t.co/EmHeFTWhuA #JabarJuaraIndonesiaJuara #JabarJuaraLahirBatin https://t.co/LI442EEim9;1;0;0;1;in;792767288;1,71416E+18;jabarprovgoid;https://twitter.com/jabarprovgoid/status/1714156507531730958
Tue Oct 17 05:46:17 +0000 2023;1,71416E+18;Kerja nyata Ganjar Pranowo #GanjarPranowo #MenangkanGanjar #GanjarMenangTotal #SahabatGanjar #Pemilu2024 https://t.co/kLUOVSqvHy;0;0;0;0;in;1572243692;1,71416E+18;jenicaongsee;https://twitter.com/jenicaongsee/status/1714155851307733344
Tue Oct 17 05:34:44 +0000 2023;1,71415E+18;Wargi Bandung Bedas...  Apel gelar pasukan tersebut merupakan bentuk pengecekan akhir kesiapan personel, sehingga pemilihan umum 2024 diharapkan dapat terselenggara dengan aman dan lancar.   #operasimantabbrata #pemilu #polrestabandung #bandungbedas https://t.co/JOjvGzXKYS;0;1;0;0;in;9,42595E+17;1,71415E+18;ProkopimKabBdg;https://twitter.com/ProkopimKabBdg/status/1714152945795928090
Tue Oct 17 05:11:34 +0000 2023;1,71415E+18;Siapp deh pak kalau menerima mah. Tapi kalian sebagai rakyat Indonesia kumaha? Nerima wae?   #zonauang #PutusanMK #MahkamahKonstitusi #Pemilu2024 https://t.co/rRcpkBGMkF;0;0;0;0;in;1,69643E+18;1,71415E+18;haikalllridwan;https://twitter.com/haikalllridwan/status/1714147116359237671
Tue Oct 17 05:06:12 +0000 2023;1,71415E+18;Pilpres 2024 Damai #ayomemilih #SukseskanPemilu2024 #Pemilu2024kondusif #PartaiPolitik #PemiluSerentak #Pemilu2024 https://t.co/f61fMRDTPp;0;0;0;0;lt;1,56446E+18;1,71415E+18;DavinaDeema;https://twitter.com/DavinaDeema/status/1714145764765770067
Tue Oct 17 04:59:45 +0000 2023;1,71414E+18;Pilpres 2024 Damai #ayomemilih #SukseskanPemilu2024 #Pemilu2024kondusif #PartaiPolitik #PemiluSerentak #Pemilu2024 https://t.co/tNBCx9Oh3f;0;0;0;0;lt;1,56446E+18;1,71414E+18;DavinaDeema;https://twitter.com/DavinaDeema/status/1714144141763039295
Tue Oct 17 03:52:09 +0000 2023;1,71413E+18;Cara Cek Nama dan Identitas Pendaftar di DPT Pemilu 2024, Nama Kamu Sudah Terdaftar Belum? https://t.co/Hwk3J7JLSu;0;0;0;0;in;1,34177E+18;1,71413E+18;mapaybandungcom;https://twitter.com/mapaybandungcom/status/1714127131083424173
Tue Oct 17 02:41:46 +0000 2023;1,71411E+18;1. #TemanPemilih Ummi Wahyuni sebagai Ketua KPU Provinsi Jawa Barat menghadiri dan memberikan pemaparan pada acara Rapat Koordinasi Cipta Trantibum Pemilu 2024 yang diselenggarakan oleh Satuan Polisi Pamong Praja Provinsi Jawa Barat, Senin (16/10/23)... https://t.co/7EJp9ln0rD;0;1;0;0;in;2799271884;1,71411E+18;kpu_jabarprov;https://twitter.com/kpu_jabarprov/status/1714109416432451713
Tue Oct 17 02:22:45 +0000 2023;1,7141E+18;wadaww, semoga menjadi keputusan yang baik dan adil 😁🤭  #Pemilu2024 #PemiluSerentak #capres2024 #infobogor;0;0;0;0;in;1,69165E+18;1,7141E+18;andireyhann;https://twitter.com/andireyhann/status/1714104632606413107
Tue Oct 17 02:13:55 +0000 2023;1,7141E+18;2. Kepolisian Resor Sukabumi Kota. Senin (16/10/2023).  Rapat yang dilaksanakan dalam rangka mempersiapkan pengamanan Pemilu tahun 2024 ini turut serta mengundang jajaran Forkopimda di lingkup Kota Sukabumi. . . #KPUMelayani #PemiluSerentak2024 #AkurSauyunan https://t.co/fgntiT1PKB;0;0;0;1;in;2799271884;1,7141E+18;kpu_jabarprov;https://twitter.com/kpu_jabarprov/status/1714102410287940028
Tue Oct 17 01:08:56 +0000 2023;1,71409E+18;Humas Polri Gelar Pasukan Kesiapan Satgas Humas Dalam Pengamanan Pemilu 2024 https://t.co/87H60ugZdP;0;0;0;0;in;4303560321;1,71409E+18;BandungBerita;https://twitter.com/BandungBerita/status/1714086054653989239
Tue Oct 17 00:36:45 +0000 2023;1,71408E+18;Hari ini Pak Bambang akan menghadiri undangan Polrestabes : Kegiatan Doa Bersama dalam Rangka Pengamanan Pelaksanaaan Pemilu 2024  Berikut Agenda Balai Kota, Selasa 17 Oktober 2023 https://t.co/Ofd5YI7MnI;0;0;0;0;in;1933882213;1,71408E+18;halo_bandung;https://twitter.com/halo_bandung/status/1714077957474451773
Mon Oct 16 12:22:05 +0000 2023;1,71389E+18;2. Rapat yang dilaksanakan dalam rangka mempersiapkan pengamanan Pemilu tahun 2024 ini turut serta mengundang jajaran Forkopimda di lingkup Kota Bandung. . . #KPUMelayani #PemiluSerentak2024 #AkurSauyunan https://t.co/RJny81zSDI;0;0;0;0;in;2799271884;1,71389E+18;kpu_jabarprov;https://twitter.com/kpu_jabarprov/status/1713893070167818431
Mon Oct 16 11:39:37 +0000 2023;1,71388E+18;2. Rangkaian penerimaan Kirab Pemilu 2024 berkibar di Kota Tasikmalaya.  Hedi mengatakan bahwa Kirab Pemilu 2024 ini harus menjadi sarana pemersatu agar Pemilu 2024 di Jawa Barat berlangsung sukses.  Selain Hedi, turut memberi sambutan Ketua KPU Kota Banjar yaitu Danial Mukhlis.. https://t.co/ntTALVjZ1X;0;1;0;0;in;2799271884;1,71388E+18;kpu_jabarprov;https://twitter.com/kpu_jabarprov/status/1713882382426845243
Mon Oct 16 11:39:31 +0000 2023;1,71388E+18;1. #TemanPemilih kPU Kota Banjar menyerahkan estafet Kirab Pemilu 2024 jalur II ke KPU Kota Tasikmalaya, Senin (16/10/23).  Penyerahan estafet panji Kirab itu dilaksanakan di Bale Kota Tasikmalaya. Hadir Kadiv Sosparmas KPU Provinsi Jawa Barat, Hedi Ardia yang membuka resmi... https://t.co/DfdMZAsiGS;0;1;0;1;in;2799271884;1,71388E+18;kpu_jabarprov;https://twitter.com/kpu_jabarprov/status/1713882360251634140
Mon Oct 16 08:39:37 +0000 2023;1,71384E+18;kirab-pemilu-2024-singgah-di-7-dapil-kota-bandung https://t.co/jxjex2HvhY;0;0;0;0;in;9,77522E+17;1,71384E+18;beritainspirat1;https://twitter.com/beritainspirat1/status/1713837085675909298
Mon Oct 16 07:24:19 +0000 2023;1,71382E+18;Pilpres 2024 #pemiluaman #SukseskanPemilu2024 #Pemilu2024kondusif #PartaiPolitik #PemiluSerentak #Pemilu2024 https://t.co/SQy0GyDhRn;0;0;0;0;lv;1,56446E+18;1,71382E+18;DavinaDeema;https://twitter.com/DavinaDeema/status/1713818138117394607
Mon Oct 16 06:58:34 +0000 2023;1,71381E+18;Prabowo ajak kita jadi motor perubahan di Pemilu 2024! dekade08;0;0;0;0;in;1,65367E+18;1,71381E+18;chandqeylan;https://twitter.com/chandqeylan/status/1713811656898486295
Mon Oct 16 06:52:54 +0000 2023;1,71381E+18;Prabowo mengajak aktivis 98 bersatu demi suksesnya Pemilu 2024 nanti! dekade08;0;0;0;0;in;1,51123E+18;1,71381E+18;HanyRetina;https://twitter.com/HanyRetina/status/1713810229413269686
Mon Oct 16 05:08:55 +0000 2023;1,71378E+18;Kadiv Humas Polri Irjen. Pol. Dr. Sandi Nugroho, S.I.K., S.H., M.Hum., memimpin apel gelar pasukan kesiapan Satgas Humas Ops Mantap Brata 2023. Operasi tersebut digelar dalam rangka pengamanan Pemilu 2024. https://t.co/ZeFjzPK5rr;0;0;0;0;in;1,59535E+18;1,71378E+18;polsek_skjd;https://twitter.com/polsek_skjd/status/1713784062908006697
Mon Oct 16 04:11:21 +0000 2023;1,71377E+18;@cimotyy Ayoo kita bisa menjadi lebih baik lagi, pemilu 2024 harus lancar . dan terimakasih untuk upaya upaya yg di lakukan polri 💪 semoga lancar jaya ayo Dewasa Berpesta Demokrasi #PemiluUntukPersatuan;0;0;0;0;in;1,544E+18;1,71376E+18;Choco1847;https://twitter.com/Choco1847/status/1713769575408669080
Mon Oct 16 04:10:02 +0000 2023;1,71377E+18;@cimotyy Semoga pemilu 2024 bisa aman ya, Semangat terus bapak polri #PemiluUntukPersatuan;0;0;0;1;in;1,6759E+18;1,71376E+18;hanachese22;https://twitter.com/hanachese22/status/1713769242280268030
Mon Oct 16 04:05:12 +0000 2023;1,71377E+18;"@strssovrld persiapan menjelang pemilu 2024 ini harus mateng sih dan juga berjalan lancar, yuk semuanya saling menghargai pilihan masing agar terciptanya Indonesia yang lebih baik #PemiluUntukPersatuan Dewasa Berpesta Demokrasi""";0;0;0;0;in;1,60618E+18;1,71376E+18;Myboo1198;https://twitter.com/Myboo1198/status/1713768024736739665
Mon Oct 16 03:46:19 +0000 2023;1,71376E+18;Kadiv Humas Polri Irjen. Pol. Dr. Sandi Nugroho, S.I.K., S.H., M.Hum., memimpin apel gelar pasukan kesiapan Satgas Humas Ops Mantap Brata 2023. Operasi tersebut digelar dalam rangka pengamanan Pemilu 2024. https://t.co/Kjgs1B7qCM;0;0;0;0;in;9,15793E+17;1,71376E+18;PolsekBanjaran;https://twitter.com/PolsekBanjaran/status/1713763274389598392
Mon Oct 16 02:09:31 +0000 2023;1,71374E+18;"@TheLadyJoker @NMS_AmpelDenta7 Bahkan seorang hakim MK pun sdh mempertanyakan keganjilan  apakah keputusan ini akan diambil utk Pemilu 2024 ini atau utk 2029 ?""""";0;0;0;1;in;113368898;1,71358E+18;mahdiequintana;https://twitter.com/mahdiequintana/status/1713738912332681705
Mon Oct 16 01:29:15 +0000 2023;1,71373E+18;Gotong Royong Cegah Penggunaan Isu SARA dalam Pemilu 2024 https://t.co/iU65Pk0N6a;0;0;0;0;in;550812458;1,71373E+18;beritajabarid;https://twitter.com/beritajabarid/status/1713728780014072059
Mon Oct 16 01:29:12 +0000 2023;1,71373E+18;Pemerintah Jamin Stok Beras Aman Hingga Pemilu dan Lebaran 2024 https://t.co/BFRuljseqZ;0;0;0;0;in;550812458;1,71373E+18;beritajabarid;https://twitter.com/beritajabarid/status/1713728769431949637
Sun Oct 15 16:35:39 +0000 2023;1,71359E+18;Pemerintah Perkuat Pengamanan dari Ancaman KST Papua Jelang Pemilu 2024 https://t.co/7bA5CRt1eg;0;0;0;0;in;550812458;1,71359E+18;beritajabarid;https://twitter.com/beritajabarid/status/1713594494644564049
Sun Oct 15 16:35:35 +0000 2023;1,71359E+18;Pemerintah Siapkan Strategi Tepat Jalankan Pemilu 2024 Kondusif https://t.co/SaG43nbJkb;0;0;0;0;in;550812458;1,71359E+18;beritajabarid;https://twitter.com/beritajabarid/status/1713594478496542797
Sun Oct 15 16:35:34 +0000 2023;1,71359E+18;Menghargai Perbedaan Politik Dalam Pemilu 2024 Adalah Wujud Demokrasi https://t.co/GOAnINLTO6;0;0;0;0;in;550812458;1,71359E+18;beritajabarid;https://twitter.com/beritajabarid/status/1713594473157140869
Sun Oct 15 16:35:32 +0000 2023;1,71359E+18;Pemerintah Miliki Strategi Atasi Ancaman KST Papua Menjelang Pemilu 2024 https://t.co/WzrQFo2Dfj;0;0;0;0;in;550812458;1,71359E+18;beritajabarid;https://twitter.com/beritajabarid/status/1713594467801067721
Sun Oct 15 13:50:42 +0000 2023;1,71355E+18;@PKSejahtera PKS harus memiliki saksi di seluruh TPS atau setidaknya 90% sehingga kecurangan bisa diminimalisir. Betul, percuma massa besar saat kampanye tetapi kecurangan menjebol sistem pemilu. Ingat, pemilu 2024 masih dari kardus dan tidak digembok seperti pemilu 2009 ke bawah.;0;0;0;1;in;2254463648;1,71351E+18;teman_siswa;https://twitter.com/teman_siswa/status/1713552983114559841
Sun Oct 15 11:22:44 +0000 2023;1,71352E+18;@MafiaWasit Jawaban logisnya, ET adlh perwakilan pemerintahan khususnya BUMN sbg sponsor utama. Bahkan bisajadi ikutan sbg panitia juga.  Jawaban ajaibnya, PEMILU 2024 BENTAR LAGIII, ytta....;0;0;0;0;in;1,52821E+18;1,71347E+18;Mudiiinn;https://twitter.com/Mudiiinn/status/1713515747849433520
Sun Oct 15 10:17:24 +0000 2023;1,7135E+18;3. Kirab Pemilu yang akan berlangsung di Kabupaten Garut dapat meningkatkan partisipasi masyarakat dalam menyukseskan pelaksanaan Pemilu 2024 nanti. . . #KPUMelayani #PemiluSerentak2024  #AkurSauyunan https://t.co/DuH6aHlgNY;0;0;0;0;in;2799271884;1,7135E+18;kpu_jabarprov;https://twitter.com/kpu_jabarprov/status/1713499305124970909
Sun Oct 15 10:16:57 +0000 2023;1,7135E+18;1. #TemanPemilih, rangkaian Kirab Pemilu 2024 Jalur IV kini telah sampai di Kabupaten Garut. KPU Kabupaten Sumedang menyerahkan Pataka Kirab Pemilu 2024 ke KPU Kabupaten Garut, Sabtu (14/10/2023)... https://t.co/7o6b0tFiwa;0;1;0;1;in;2799271884;1,7135E+18;kpu_jabarprov;https://twitter.com/kpu_jabarprov/status/1713499193661354047
Sun Oct 15 09:50:30 +0000 2023;1,71349E+18;3. #TemanPemilih nantikan Kirab Pemilu 2024 hadir dikotamu! . . #KPUMelayani #PemiluSerentak2024 #AkurSauyunan https://t.co/q1NmJM8uOn;0;0;0;0;in;2799271884;1,71349E+18;kpu_jabarprov;https://twitter.com/kpu_jabarprov/status/1713492534385901878
Sun Oct 15 09:50:22 +0000 2023;1,71349E+18;2. Tempat-tempat keramaian dengan membagikan leaflet yang berisikan informasi hari pemungutan suara, peserta pemilu, cara cek DPT online, serta ajakan ke TPS pada hari Rabu, 14 Februari 2024... https://t.co/iNkknGoFzW;0;1;0;0;in;2799271884;1,71349E+18;kpu_jabarprov;https://twitter.com/kpu_jabarprov/status/1713492500969910313
Sun Oct 15 09:50:11 +0000 2023;1,71349E+18;1. #TemanPemilih, Kirab Pemilu 2024 Jalur II di Kota Banjar berlangsung dari tanggal 9 Oktober 2023 hingga 16 Oktober 2023. Kegiatan diisi dengan sosialisasi dan pendidikan pemilih kepada masyarakat umum di tiap kecamatan.  Kegiatan tersebut menyasar masyarakat yang berada di... https://t.co/0kXDFV431b;0;1;0;0;in;2799271884;1,71349E+18;kpu_jabarprov;https://twitter.com/kpu_jabarprov/status/1713492456812302547
Sun Oct 15 08:07:41 +0000 2023;1,71347E+18;Hayuu urang ngagunakeun hak suara sebagai rakyat Indonesia di 2024!! 👌🤝  Sumber: instagram meldasimbolon2  #zonauang #pemilu2024 #pilpres2024 #prabowosubianto #GanjarPranowo #AniesBaswedan https://t.co/PFCZoYCf5L;0;0;0;0;in;1,69643E+18;1,71347E+18;haikalllridwan;https://twitter.com/haikalllridwan/status/1713466661830009258
Sat Oct 14 15:05:48 +0000 2023;1,71321E+18;3. Kepala Subbagian Teknis Penyelenggaraan Pemilu, Partisipasi, dan Hubungan Masyarakat KPU Kabupaten Garut, KPU Kabupaten Sumedang, KPU Kota Banjar, dan KPU Kota Tasikmalaya.  Dalam arahannya Hedi menekankan prinsip Imparsialitas dalam pelaksanaan Kirab Pemilu 2024 bagi... https://t.co/ypjzz2Px1D;0;1;0;0;in;2799271884;1,71321E+18;kpu_jabarprov;https://twitter.com/kpu_jabarprov/status/1713209498272416037
Sat Oct 14 15:05:40 +0000 2023;1,71321E+18;1. #TemanPemilih, KPU Provinsi Jawa Barat melaksanakan Rapat Koordinasi Serah Terima Estafet Kirab Pemilu Tahun 2024 Jalur IV dan II secara daring. Jumat (13/10/2023).  Rapat dihadiri Ketua Divisi Sosialisasi, Pendidikan Pemilih, dan Partisipasi Masyarakat, Hedi Ardia dan... https://t.co/F7zGfKEPAp;0;1;0;1;in;2799271884;1,71321E+18;kpu_jabarprov;https://twitter.com/kpu_jabarprov/status/1713209464311173164
Sat Oct 14 14:52:37 +0000 2023;1,71321E+18;sptnya anda tak punya system juga keberanian utk mengawasi kerja anak buah anda, pak @jokowi . terlalu asyik dgn telenovela utk pemilu 2024 ya. terlambat sudah! https://t.co/UDBJQRP2C4;0;0;0;0;in;43615862;1,71321E+18;Pinondang_dav;https://twitter.com/Pinondang_dav/status/1713206180624089595
Sat Oct 14 12:37:11 +0000 2023;1,71317E+18;DPD PDI Perjuangan Sumut menggelar rapat koordinasi pengawalan pemilu 2024. Malming Malam Minggu #PDIPerjuangan https://t.co/ptjd7Cgewm;0;0;0;0;in;1,63401E+18;1,71317E+18;ChristallineAn1;https://twitter.com/ChristallineAn1/status/1713172094522126403
Sat Oct 14 12:30:02 +0000 2023;1,71317E+18;INFOCIMAHI, CIMAHI - Dalam rangka persiapan menjelang Pemilu 2024, Polres Cimahi bersama Polda Jabar menggelar simulasi sistem pengamanan dalam kota (Sispamkota) yang berlokasi di Lapangan Brigif 15 Kujang, Kota Cimahi, pada Kamis (12/10/23). https://t.co/2MrgeiqRrq;0;0;0;0;in;574546780;1,71317E+18;infocimahico;https://twitter.com/infocimahico/status/1713170295811715179
Sat Oct 14 12:24:39 +0000 2023;1,71317E+18;DPD PDI Perjuangan Sumut menggelar rapat koordinasi pengawalan pemilu 2024. Malming Malam Minggu #PDIPerjuangan https://t.co/aEeDllS0C5;0;0;0;0;in;1,6183E+18;1,71317E+18;GraciaSulistiyo;https://twitter.com/GraciaSulistiyo/status/1713168940099375548
